iteration_id,timestamp,decision,sortino,calmar,trade_count,risk_passed,hypothesis,reason
2026-05-17-2ad4875,2026-05-17T06:33:14,REVERTED,3.6303749397181253,7.429181567091349,189,True,Adding a PIT-safe six-month range-confirmation term will improve validation Sortino by preferring intermediate momentum names that remain near their 126-day range highs rather than names whose positive trend has already materially decayed.,sortino 3.630 did not improve on prev 3.652368255577813
2026-05-17-87db1e3,2026-05-17T06:35:25,KEPT,3.7968885204229252,7.671338363091986,189,True,Adding a PIT-safe recent close-location confirmation term will improve validation Sortino by ensuring the kept 63-day accumulation signal is still active over the most recent month rather than stale.,"sortino 3.797 > prev 3.652368255577813, agg_dd 15.1%, catastrophe gate clear, anti-overfit gates passed"
2026-05-17-77518a6,2026-05-17T06:37:54,REVERTED,0.5659287111718669,0.3826289062750074,100,True,"Adding a PIT-safe red-day close-resilience term will improve validation Sortino by preferring momentum names that attract intraday dip-buying on down closes, reducing downside-tail exposure without changing fixed-slot construction.",sortino 0.566 did not improve on prev 3.7968885204229252 | anti-overfit FAILED: bonferroni(p=0.4303 >= alpha/N=0.1000) · random_walk_mc(only 57.00% percentile vs RW null)
2026-05-17-aa19796,2026-05-17T06:40:10,REVERTED,3.3914874101356505,7.283568369568557,194,True,"Adding a PIT-safe recent participation confirmation term will improve validation Sortino by favoring already-qualified momentum names whose traded value has expanded recently, indicating current institutional participation rather than stale price strength.",sortino 3.391 did not improve on prev 3.7968885204229252
2026-05-17-dcf0c36,2026-05-17T06:42:21,KEPT,3.8279484160617105,7.830672298724033,188,True,"Adding a PIT-safe recent downside-shock veto will improve validation Sortino by avoiding otherwise qualified momentum names that have suffered a sharp single-day selloff inside the lookback window, which often signals distribution before the ranking metrics fully decay.","sortino 3.828 > prev 3.7968885204229252, agg_dd 12.0%, catastrophe gate clear, anti-overfit gates passed"
2026-05-17-476d877,2026-05-17T06:45:52,REVERTED,2.9932162165420055,5.741923904983531,187,True,Replacing the full 126-day momentum score with a PIT-safe pre-recent momentum leg will improve validation Sortino by avoiding names whose rank is driven mainly by the last-month surge while keeping the proven recent accumulation confirmation intact.,"sortino 2.993 did not improve on prev 3.8279484160617105 | anti-overfit FAILED: sub_period_stationarity(signed min/max Sortino ratio across 2 sub-periods = 0.0792 (need ≥ 0.20); sub-periods = [+4.176, +0.331])"
2026-05-17-e523ae2,2026-05-17T06:48:10,REVERTED,3.776858763651791,7.793463454397062,187,True,"Adding a PIT-safe weak-market participation veto will improve validation Sortino by avoiding momentum names that systematically trade down on higher value during broad-market red days, filtering distribution that is not captured by ordinary accumulation or close-location metrics.",sortino 3.777 did not improve on prev 3.8279484160617105
2026-05-17-addb2d9,2026-05-17T06:51:04,REVERTED,3.7995077048892183,7.76280858707125,189,True,Adding a PIT-safe jump-dependency veto will improve validation Sortino by avoiding momentum names whose 63-day trend is dominated by a single event-like up day rather than persistent accumulation.,sortino 3.800 did not improve on prev 3.8279484160617105
2026-05-17-38f030a,2026-05-17T06:55:27,REVERTED,3.8279484160617105,7.830672298724033,188,True,Adding a PIT-safe adverse-news veto will improve validation Sortino by avoiding technically strong momentum names on days with actionable negative company news before the price-based filters fully decay.,sortino 3.828 did not improve on prev 3.8279484160617105
2026-05-17-58587e0,2026-05-17T07:07:47,REVERTED,3.641215118902765,7.482412350549562,188,True,"Adding a PIT-safe lower-tail trend breadth check will improve validation Sortino by rejecting momentum names whose 126-day gain is positive but overly dependent on too few positive trading days, filtering fragile advances without repeating the failed jump-dependency or volatility-normalized variants",sortino 3.641 did not improve on prev 3.8279484160617105
2026-05-17-12d0d5b,2026-05-17T07:10:20,REVERTED,3.807573278378901,7.792547577811768,190,True,"Requiring a broader pool of qualified names before deploying fixed slots will improve validation Sortino by staying in cash during narrow, fragile momentum regimes without adding another stock-level filter.",sortino 3.808 did not improve on prev 3.8279484160617105
2026-05-17-52c0dba,2026-05-17T07:12:35,REVERTED,3.5336846822692154,6.822853853718447,180,True,Adding a PIT-safe active-universe breadth throttle will improve validation Sortino by cutting gross exposure during broad-market weakness while preserving the proven stock ranking in normal regimes.,sortino 3.534 did not improve on prev 3.8279484160617105
2026-05-17-77bba17,2026-05-17T07:14:42,REVERTED,2.593548952385655,5.417579471032431,195,True,"Switching the biweekly rebalance parity to the alternate Friday cohort will improve validation Sortino by changing entry and exit timing while preserving the kept stock-selection thesis, fixed-slot sizing, PIT universe gate, sector cap, and Dhan-cost-aware cadence.","sortino 2.594 did not improve on prev 3.8279484160617105 | anti-overfit FAILED: sub_period_stationarity(signed min/max Sortino ratio across 2 sub-periods = -0.1539 (need ≥ 0.20); sub-periods = [+4.021, -0.619])"
2026-05-17-ea8accf,2026-05-17T07:16:54,REVERTED,3.743970588162724,6.9429316475139355,187,True,"Increasing fixed risk slots from 16 to 18 will improve validation Sortino by reducing single-name downside tails while preserving the kept ranking, PIT universe gate, sector cap, biweekly cadence, and fixed-slot cash behavior.",sortino 3.744 did not improve on prev 3.8279484160617105
2026-05-17-bcfae9e,2026-05-17T07:19:03,REVERTED,3.6723067089514183,7.270823494372786,142,True,Lowering fixed risk slots from 16 to 15 will improve validation Sortino by modestly concentrating the already high-conviction ranked book while staying within the catastrophe-gate minimum position count and preserving fixed-slot sizing.,sortino 3.672 did not improve on prev 3.8279484160617105
2026-05-17-fb1ba70,2026-05-17T07:21:15,KEPT,3.8348443215568286,7.896755377862082,188,True,Replacing the hard breadth-of-opportunity floor with a softer rank-depth requirement will improve validation Sortino by preserving the kept strategy's candidate sufficiency check while avoiding unnecessary cash drag in otherwise high-quality but moderately narrow regimes.,"sortino 3.835 > prev 3.8279484160617105, agg_dd 12.0%, catastrophe gate clear, anti-overfit gates passed"
2026-05-17-63b54a9,2026-05-17T07:23:30,REVERTED,3.503498337225753,7.29184919690655,183,True,Adding a PIT-safe index-trend stress veto will improve validation Sortino by keeping the proven stock-selection book active in normal regimes while moving to cash only when the broad Nifty 50 tape is below its 200-day trend and therefore most likely to turn long-only momentum into downside exposure.,sortino 3.503 did not improve on prev 3.8348443215568286
2026-05-17-9cc7af0,2026-05-17T07:25:46,REVERTED,3.4553355071144725,6.826619532588849,114,True,"Adding PIT-safe soft retention for still-qualified existing holdings will improve validation Sortino by reducing unnecessary biweekly churn and Dhan DP sell costs while preserving the proven ranking, fixed-slot sizing, universe gate, and sector cap.",sortino 3.455 did not improve on prev 3.8348443215568286
2026-05-17-cd693fa,2026-05-17T07:28:53,REVERTED,3.4547777685993446,7.5992596974722435,183,True,Adding a PIT-safe recent volatility expansion penalty will improve validation Sortino by preserving the kept momentum/accumulation ranking while demoting names whose latest month has become materially noisier than their intermediate volatility profile.,sortino 3.455 did not improve on prev 3.8348443215568286
2026-05-17-802bd97,2026-05-17T07:31:05,REVERTED,3.590265473484697,6.555526755210631,215,True,Tightening the short-term overextension filter will improve validation Sortino by avoiding otherwise strong momentum names whose last week already consumed too much of the expected swing-trade edge before entry.,"sortino 3.590 did not improve on prev 3.8348443215568286 | anti-overfit FAILED: sub_period_stationarity(signed min/max Sortino ratio across 2 sub-periods = 0.0591 (need ≥ 0.20); sub-periods = [+5.053, +0.298])"
2026-05-17-81b0c46,2026-05-17T07:33:14,REVERTED,3.8348441841595426,7.896466256447999,188,True,"Adding a PIT-safe gap-fade veto will improve validation Sortino by avoiding momentum candidates whose latest close shows distribution after an event-like upside gap, a pattern not captured by the existing close-to-close exhaustion filter.",sortino 3.835 did not improve on prev 3.8348443215568286
2026-05-17-bb126f8,2026-05-17T07:35:28,REVERTED,3.287513745938562,5.358725605022045,183,True,"Adding a PIT-safe market crash-day breadth veto will improve validation Sortino by moving to cash only when the liquid universe shows broad same-day downside pressure, avoiding systemic selloff entries without repeating the slower Nifty-200DMA regime veto.",sortino 3.288 did not improve on prev 3.8348443215568286
2026-05-17-59cfb85,2026-05-17T07:37:37,REVERTED,3.78132671780861,7.758214344002537,187,True,Replacing the close-only intermediate range-location measure with a true OHLC high-low range location will improve validation Sortino by better distinguishing stocks closing constructively within their actual traded range from names that only look strong on close-to-close data.,sortino 3.781 did not improve on prev 3.8348443215568286
2026-05-17-82a8bc9,2026-05-17T07:39:52,REVERTED,3.056249031501864,6.681805785635536,183,False,Replacing the full realized-volatility penalty with downside-only semivolatility will improve validation Sortino by keeping constructive upside trend variability while still avoiding names with poor downside tails.,"sortino 3.056 did not improve on prev 3.8348443215568286 | catastrophe: gross exposure: max 142.7% > 100% (cash account — leverage error) | anti-overfit FAILED: sub_period_stationarity(signed min/max Sortino ratio across 2 sub-periods = -0.0037 (need ≥ 0.20); sub-periods = [+4.422, -0.016])"
2026-05-17-2c0b104,2026-05-17T07:43:17,REVERTED,3.5191429342822365,7.671788906043802,192,True,"Adding a PIT-safe two-sided relative participation score will improve validation Sortino by favoring momentum names that outperform the active universe on both up-tape and down-tape days, not just during weak-market sessions.",sortino 3.519 did not improve on prev 3.8348443215568286
2026-05-17-da1de51,2026-05-17T07:45:26,REVERTED,2.353510988799515,3.784338634332518,224,True,Adding a PIT-safe recent reversal recovery requirement will improve validation Sortino by avoiding momentum names that are still below their short-term pre-shock level while preserving the kept trend and accumulation thesis.,"sortino 2.354 did not improve on prev 3.8348443215568286 | anti-overfit FAILED: sub_period_stationarity(signed min/max Sortino ratio across 2 sub-periods = -0.0066 (need ≥ 0.20); sub-periods = [+3.410, -0.023])"
2026-05-17-252f946,2026-05-17T07:51:21,REVERTED,3.2750165451443394,7.19861534637399,194,True,"Adding a PIT-safe traded-value sponsorship rank term will improve validation Sortino by favoring momentum names whose recent liquidity participation is expanding rather than fading, without changing exposure, cadence, sector caps, or universe gating.",sortino 3.275 did not improve on prev 3.8348443215568286
2026-05-17-ea54ca8,2026-05-17T08:03:43,REVERTED,3.271100213960317,7.460757417020115,122,True,Adding a PIT-safe stale-breakout penalty will improve validation Sortino by favoring momentum names whose intermediate trend is still making recent highs rather than drifting below an older peak.,sortino 3.271 did not improve on prev 3.8348443215568286
2026-05-17-883e4be,2026-05-17T08:06:08,REVERTED,3.699981360792134,7.475118589438086,182,True,"Adding a PIT-safe macro stress de-risking overlay will improve validation Sortino by reducing fixed-slot exposure only when continuous India VIX and Nifty 50 trend signals indicate unusually hostile market conditions, while leaving stock selection unchanged in normal regimes.",sortino 3.700 did not improve on prev 3.8348443215568286
2026-05-17-7935198,2026-05-17T08:08:23,REVERTED,3.62995805726263,7.698835113172927,183,True,"Adding a PIT-safe volatility contraction confirmation will improve validation Sortino by favoring momentum candidates whose recent realized volatility has compressed versus their intermediate volatility, indicating cleaner trend continuation without changing exposure, cadence, sector caps, or univer",sortino 3.630 did not improve on prev 3.8348443215568286
2026-05-17-89f812f,2026-05-17T08:10:37,REVERTED,2.7550264230203356,5.925400556425957,193,True,Adding a PIT-safe downside capture veto will improve validation Sortino by avoiding momentum candidates that still lose materially on weak market days despite passing the average defensive relative-strength score.,sortino 2.755 did not improve on prev 3.8348443215568286
2026-05-17-fe553f5,2026-05-17T08:12:47,REVERTED,3.4553355071144725,6.826619532588849,114,True,"Adding a PIT-safe winner-retention buffer will improve validation Sortino by reducing unnecessary sells of still-healthy existing winners while preserving the fixed-slot sizing, universe gate, and sector cap.",sortino 3.455 did not improve on prev 3.8348443215568286
2026-05-17-f3c8644,2026-05-17T08:15:41,REVERTED,3.8348443215568286,7.896755377862082,188,True,"Adding a PIT-safe news-risk overlay will improve validation Sortino by avoiding otherwise attractive momentum names when recent India-specific sentiment/events indicate adverse idiosyncratic risk, while leaving the proven price construction unchanged when news cache is absent.",sortino 3.835 did not improve on prev 3.8348443215568286
2026-05-17-0e37579,2026-05-17T08:27:53,REVERTED,2.797016614641613,4.0096778456934565,118,True,"Adding a PIT-safe 12-1 momentum anchor will improve validation Sortino by making the ranked book favor stocks with durable one-year relative strength while preserving the existing intermediate trend, fixed-slot sizing, universe gate, and sector cap.","sortino 2.797 did not improve on prev 3.8348443215568286 | anti-overfit FAILED: parsimony(baseline params=8, strategy=9; +1 param(s) need Sortino +0.10, has -1.04) · sub_period_stationarity(signed min/max Sortino ratio across 2 sub-periods = -0.1829 (need ≥ 0.20); sub-periods = [+4.398, -0.804])"
2026-05-17-73b1025,2026-05-17T08:30:12,REVERTED,2.593548952385655,5.417579471032431,195,True,"Shifting the biweekly rebalance schedule from odd ISO Fridays to even ISO Fridays will improve validation Sortino by avoiding a timing-specific entry cohort while preserving the proven ranking, risk slots, universe gate, and sector cap.","sortino 2.594 did not improve on prev 3.8348443215568286 | anti-overfit FAILED: sub_period_stationarity(signed min/max Sortino ratio across 2 sub-periods = -0.1539 (need ≥ 0.20); sub-periods = [+4.021, -0.619])"
2026-05-17-c584022,2026-05-17T08:32:24,REVERTED,3.6779436803374845,6.879932168971584,141,True,Tightening the sector concentration cap from 25% to 20% will improve validation Sortino by reducing shared sector drawdown risk while preserving the existing proven PIT-safe ranking and fixed-slot sizing logic.,sortino 3.678 did not improve on prev 3.8348443215568286
2026-05-17-68d9822,2026-05-17T08:34:35,REVERTED,3.532064811932761,7.316053166802063,182,True,"Adding a PIT-safe minimum absolute score floor will improve validation Sortino by keeping fixed risk slots in cash when the cross-sectional book has enough names but the marginal candidates have weak combined trend, accumulation, defensive, and risk-adjusted quality.","sortino 3.532 did not improve on prev 3.8348443215568286 | anti-overfit FAILED: parsimony(baseline params=8, strategy=9; +1 param(s) need Sortino +0.10, has -0.30)"
2026-05-17-afb145f,2026-05-17T08:36:48,REVERTED,3.6723067089514183,7.270823494372786,142,True,"Reducing fixed risk slots from 16 to 15 will improve validation Sortino by modestly concentrating capital in the highest-ranked names while staying within the program's minimum diversification constraint and preserving all existing PIT, sector, and fixed-slot safeguards.",sortino 3.672 did not improve on prev 3.8348443215568286
