iteration_id,timestamp,decision,sortino,calmar,trade_count,risk_passed,hypothesis,reason
2026-05-17-1d3662c,2026-05-17T00:40:30,REVERTED,0.34054451848421763,0.21804616992839215,144,True,"Adding a PIT-safe intraday range risk penalty will improve validation Sortino by avoiding trend candidates whose close-to-close smoothness hides unstable high-low trading ranges, while preserving the existing momentum-quality thesis.","sortino 0.341 did not improve on prev 3.166988802108574 | anti-overfit FAILED: bonferroni(p=0.3118 >= alpha/N=0.0167) · random_walk_mc(only 68.85% percentile vs RW null) · sub_period_stationarity(signed min/max Sortino ratio across 2 sub-periods = -1.2620 (need ≥ 0.20); sub-periods = [+1.120, -1.414])"
2026-05-17-a3cb311,2026-05-17T00:42:30,REVERTED,1.9807709573597876,3.809187392069532,212,False,"Adding a PIT-safe short-horizon reversal confirmation will improve validation Sortino by favoring intermediate uptrends whose pullback has started to resolve over the last three sessions, avoiding entries that are still falling.","sortino 1.981 did not improve on prev 3.166988802108574 | aggregate DD regressed: 46.5% > prev 10.4% + 10pp tolerance | catastrophe: gross exposure: max 170.3% > 100% (cash account — leverage error) | anti-overfit FAILED: bonferroni(p=0.1584 >= alpha/N=0.0143) · random_walk_mc(only 84.20% percentile vs RW null) · sub_period_stationarity(signed min/max Sortino ratio across 2 sub-periods = -0.5172 (need ≥ 0.20); sub-periods = [+3.715, -1.921])"
2026-05-17-917227b,2026-05-17T00:44:41,REVERTED,2.2487471764057108,4.066992250456557,205,True,"Adding a PIT-safe turnover participation guard will improve validation Sortino by avoiding technically strong names whose recent advance is occurring on unusually thin volume, reducing stale-price and weak-follow-through entries without changing fixed-slot sizing or gross exposure.","sortino 2.249 did not improve on prev 3.166988802108574 | anti-overfit FAILED: sub_period_stationarity(signed min/max Sortino ratio across 2 sub-periods = 0.0730 (need ≥ 0.20); sub-periods = [+3.146, +0.230])"
2026-05-17-98416aa,2026-05-17T00:46:40,REVERTED,3.1485729800220765,5.885340014209357,179,True,"Adding a PIT-safe asymmetric downside-volatility penalty will improve validation Sortino by distinguishing smooth compounders from trend names whose realized volatility is concentrated in negative sessions, without changing exposure, cadence, universe enforcement, or sector construction.",sortino 3.149 did not improve on prev 3.166988802108574
2026-05-17-7956392,2026-05-17T00:49:26,REVERTED,3.166988802108574,5.935216565906912,177,True,"Adding a PIT-safe LLM news-risk overlay will improve validation Sortino by avoiding otherwise attractive momentum names with fresh adverse sentiment or high-risk corporate event flags, while leaving no-news names unchanged.",sortino 3.167 did not improve on prev 3.166988802108574
2026-05-17-5d15d95,2026-05-17T00:51:21,REVERTED,3.031735786405346,4.885258427453613,173,True,"Adding a no-new-parameter off-universe exposure reserve will improve validation Sortino by preventing stale holdings that leave the PIT universe from combining with new buys into excess gross exposure, while preserving fixed-slot sizing for eligible names.",sortino 3.032 did not improve on prev 3.166988802108574
2026-05-17-31c5658,2026-05-17T00:53:15,KEPT,3.1886060453978216,6.651082478965423,185,True,Reducing fixed risk slots from 18 to 16 will improve validation Sortino by modestly concentrating the already-filtered low-volatility trend book while staying above the 15-position catastrophe floor and preserving cash-account gross exposure.,"sortino 3.189 > prev 3.166988802108574, agg_dd 13.1%, catastrophe gate clear, anti-overfit gates passed"
2026-05-17-0bdb2d2,2026-05-17T00:55:10,REVERTED,3.0553939207456344,5.843494034237411,138,True,"Reducing fixed risk slots from 16 to the allowed floor of 15 will improve validation Sortino by giving the already-filtered low-volatility trend book slightly more exposure per selected name while still respecting the catastrophe floor, sector cap, and cash-account gross limit.","sortino 3.055 did not improve on prev 3.1886060453978216 | anti-overfit FAILED: sub_period_stationarity(signed min/max Sortino ratio across 2 sub-periods = 0.0773 (need ≥ 0.20); sub-periods = [+4.267, +0.330])"
2026-05-17-d7d4809,2026-05-17T00:57:05,REVERTED,2.5903475503341977,5.264495879284751,109,True,Adding a PIT-safe incumbent retention band will improve validation Sortino by reducing unnecessary biweekly churn and DP-charge drag while still forcing exits from weakened names that fall outside the ranked breadth buffer.,"sortino 2.590 did not improve on prev 3.1886060453978216 | anti-overfit FAILED: sub_period_stationarity(signed min/max Sortino ratio across 2 sub-periods = 0.0720 (need ≥ 0.20); sub-periods = [+3.626, +0.261])"
2026-05-17-ecb8ce8,2026-05-17T00:58:56,REVERTED,2.7831872691070023,6.15236885677381,184,True,Honoring the fixed biweekly parity instead of resetting it to each fold's first Friday will improve validation Sortino by making rebalance timing stable across walk-forward folds rather than anchoring to an arbitrary fold start date.,"sortino 2.783 did not improve on prev 3.1886060453978216 | anti-overfit FAILED: sub_period_stationarity(signed min/max Sortino ratio across 2 sub-periods = -0.0205 (need ≥ 0.20); sub-periods = [+4.057, -0.083])"
2026-05-17-efffc1a,2026-05-17T01:00:46,KEPT,3.1961034722967954,6.859307307150354,187,True,Increasing gross exposure from 0.90 to 0.94 will improve validation Sortino by modestly scaling the already-kept positive-edge 16-slot book while keeping enough cash buffer to avoid gross-exposure and drawdown gate failures.,"sortino 3.196 > prev 3.1886060453978216, agg_dd 13.3%, catastrophe gate clear, anti-overfit gates passed"
2026-05-17-af232b5,2026-05-17T01:02:43,KEPT,3.2541190820225,7.212599846726907,188,True,Increasing the existing gross exposure from 0.94 to 0.97 should improve validation Sortino by continuing the kept positive-edge exposure scaling while preserving a cash buffer below the 100% gross catastrophe constraint.,"sortino 3.254 > prev 3.1961034722967954, agg_dd 13.6%, catastrophe gate clear, anti-overfit gates passed"
2026-05-17-dc3a845,2026-05-17T01:04:37,REVERTED,3.253657904016755,7.272033316887366,188,True,Raising the existing gross exposure from 0.97 to 0.99 will improve mean validation Sortino by capturing more of the already-kept positive-edge 16-slot book while still leaving a small cash buffer below the 100% gross catastrophe limit.,sortino 3.254 did not improve on prev 3.2541190820225
2026-05-17-54092e6,2026-05-17T01:06:31,REVERTED,3.0549824757782797,5.838184610485873,139,True,Reducing the existing sector cap from 25% to 20% should improve validation Sortino by reducing sector-cluster drawdowns in the current high-gross 16-slot book while preserving the same PIT-safe ranking signal and fixed-slot sizing.,"sortino 3.055 did not improve on prev 3.2541190820225 | anti-overfit FAILED: sub_period_stationarity(signed min/max Sortino ratio across 2 sub-periods = 0.0748 (need ≥ 0.20); sub-periods = [+4.271, +0.319])"
2026-05-17-206f1d5,2026-05-17T01:08:24,REVERTED,2.883700386529976,6.628834468188392,244,True,"Requiring a small positive fast trend confirmation before ranking will improve validation Sortino by avoiding candidates whose intermediate momentum is already rolling over, while preserving the existing pullback and exhaustion controls.","sortino 2.884 did not improve on prev 3.2541190820225 | anti-overfit FAILED: sub_period_stationarity(signed min/max Sortino ratio across 2 sub-periods = 0.1519 (need ≥ 0.20); sub-periods = [+3.902, +0.593])"
2026-05-17-73576cf,2026-05-17T01:10:18,REVERTED,3.25369045282884,7.2122435732915555,188,True,Reducing the existing one-week exhaustion penalty should improve mean validation Sortino by letting strong intermediate trend winners remain eligible when short-term strength is constructive rather than treating all >5.5% fast moves as excessive.,sortino 3.254 did not improve on prev 3.2541190820225
2026-05-17-56d97ec,2026-05-17T01:12:16,REVERTED,3.174291594803495,7.1681948671306035,190,True,"Adding a PIT-safe cross-sectional trend-relative score should improve validation Sortino by favoring stocks with true leadership over broad-market beta while keeping the existing absolute uptrend, volatility, pullback, sector-cap, and fixed-slot controls intact.",sortino 3.174 did not improve on prev 3.2541190820225
2026-05-17-a0323b8,2026-05-17T01:14:11,REVERTED,2.215089170718996,6.055407753559132,116,True,"Switching from biweekly to four-week rebalancing will improve validation Sortino by reducing DP-charge churn and letting the existing intermediate-trend winners compound longer without changing the PIT universe, ranking signal, fixed-slot sizing, or sector cap.","sortino 2.215 did not improve on prev 3.2541190820225 | aggregate DD regressed: 26.7% > prev 13.6% + 10pp tolerance | anti-overfit FAILED: sub_period_stationarity(signed min/max Sortino ratio across 2 sub-periods = -0.3039 (need ≥ 0.20); sub-periods = [+3.699, -1.124])"
2026-05-17-63a8fbc,2026-05-17T01:16:05,REVERTED,3.1732662346826617,7.218120484525972,190,True,"Adding a PIT-safe high-watermark breakout participation score will improve validation Sortino by favoring trend candidates that are close to confirming fresh multi-month highs while avoiding late, overextended one-week moves.",sortino 3.173 did not improve on prev 3.2541190820225
2026-05-17-1c3b407,2026-05-17T01:18:03,REVERTED,3.184835169768132,6.977295528246336,184,True,Adding a no-new-parameter macro-regime exposure throttle should improve validation Sortino by keeping the proven fixed-slot momentum book mostly intact while reducing downside participation during India risk_off and shock regimes.,"sortino 3.185 did not improve on prev 3.2541190820225 | anti-overfit FAILED: sub_period_stationarity(signed min/max Sortino ratio across 2 sub-periods = 0.1888 (need ≥ 0.20); sub-periods = [+4.244, +0.801])"
2026-05-17-8768349,2026-05-17T01:23:24,REVERTED,3.1843726327071327,7.042833043589114,188,True,"Adding a PIT-safe active-universe breadth exposure throttle will improve validation Sortino by reducing gross only during broad cross-sectional selloffs where a long-only momentum book has poor payoff asymmetry, while leaving the proven ranker unchanged in healthy markets.",sortino 3.184 did not improve on prev 3.2541190820225
2026-05-17-95a099c,2026-05-17T01:25:16,REVERTED,3.075526188510484,6.637512061122621,187,True,"Replacing part of the raw 126-day momentum score with risk-adjusted intermediate momentum will improve validation Sortino by favoring smoother leaders whose trend return is large relative to realized volatility, without changing fixed-slot sizing, cadence, or exposure.","sortino 3.076 did not improve on prev 3.2541190820225 | anti-overfit FAILED: sub_period_stationarity(signed min/max Sortino ratio across 2 sub-periods = 0.1656 (need ≥ 0.20); sub-periods = [+4.138, +0.685])"
2026-05-17-082419c,2026-05-17T01:27:08,REVERTED,3.196667004738205,7.2089332486959234,194,True,"Adding a PIT-safe one-day downside shock guard will improve validation Sortino by excluding momentum names that just printed an abnormal down day, where short-horizon reversal risk is high for a biweekly long-only book.",sortino 3.197 did not improve on prev 3.2541190820225
2026-05-17-54dd0e1,2026-05-17T01:29:00,REVERTED,2.763944418808472,4.921937819175705,175,True,Replacing the primary trend leg with 12-1 skip-month momentum should improve validation Sortino by ranking stocks on persistent intermediate leadership while reducing exposure to short-term reversal from the most recent month.,"sortino 2.764 did not improve on prev 3.2541190820225 | anti-overfit FAILED: sub_period_stationarity(signed min/max Sortino ratio across 2 sub-periods = 0.0240 (need ≥ 0.20); sub-periods = [+3.950, +0.095])"
2026-05-17-3e148f9,2026-05-17T01:30:58,REVERTED,2.7498721903473506,6.509277526258239,188,False,Replacing the total-volatility penalty with downside semivolatility will improve validation Sortino by penalizing choppy downside risk while no longer discarding leaders whose realized volatility is mostly upside participation.,"sortino 2.750 did not improve on prev 3.2541190820225 | catastrophe: gross exposure: max 150.2% > 100% (cash account — leverage error) | anti-overfit FAILED: sub_period_stationarity(signed min/max Sortino ratio across 2 sub-periods = 0.0003 (need ≥ 0.20); sub-periods = [+3.972, +0.001])"
2026-05-17-41f6d53,2026-05-17T01:34:37,REVERTED,2.608437368899362,6.646250222072049,193,True,"Adding PIT-safe volume accumulation confirmation will improve validation Sortino by preferring momentum leaders whose recent up days carry stronger participation than down days, while avoiding distribution-heavy names that price-only trend filters miss.",sortino 2.608 did not improve on prev 3.2541190820225
2026-05-17-8597241,2026-05-17T01:46:36,REVERTED,2.7443264524783997,5.890320996757391,165,True,"Adding a same-universe median trend hurdle will improve validation Sortino by requiring selected momentum names to show leadership versus the current liquid NSE opportunity set, not just positive absolute momentum.","sortino 2.744 did not improve on prev 3.2541190820225 | anti-overfit FAILED: sub_period_stationarity(signed min/max Sortino ratio across 2 sub-periods = -0.0464 (need ≥ 0.20); sub-periods = [+4.048, -0.188])"
2026-05-17-2a3e3ee,2026-05-17T01:48:31,REVERTED,2.9999454861926953,7.207415484536865,191,True,Adding a drawdown-recovery quality leg should improve validation Sortino by preferring momentum names that have already repaired recent damage rather than names still sitting in deep intermediate drawdowns.,"sortino 3.000 did not improve on prev 3.2541190820225 | anti-overfit FAILED: sub_period_stationarity(signed min/max Sortino ratio across 2 sub-periods = 0.1759 (need ≥ 0.20); sub-periods = [+4.019, +0.707])"
2026-05-17-0e26f39,2026-05-17T01:50:26,KEPT,3.4038275153908293,7.3440874574941555,190,True,"Adding a no-new-parameter gap-risk filter will improve validation Sortino by avoiding momentum names whose latest close is too far above the prior close, where next-open delivery fills are most exposed to short-term mean reversion and poor entry prices.","sortino 3.404 > prev 3.2541190820225, agg_dd 13.6%, catastrophe gate clear, anti-overfit gates passed"
2026-05-17-e3b8db4,2026-05-17T01:52:39,REVERTED,2.8458228752554415,6.186802097305973,110,True,Adding a no-new-parameter holding-retention pass will improve validation Sortino by reducing biweekly DP-charge churn when existing holdings still rank inside the near-top candidate band.,"sortino 2.846 did not improve on prev 3.4038275153908293 | anti-overfit FAILED: sub_period_stationarity(signed min/max Sortino ratio across 2 sub-periods = 0.0907 (need ≥ 0.20); sub-periods = [+3.951, +0.358])"
2026-05-17-550cc7a,2026-05-17T01:54:33,REVERTED,3.320098980549461,7.345759352208794,186,True,"Adding a PIT-safe downside tail filter will improve validation Sortino by excluding momentum candidates whose recent path includes a large single-day loss, a common precursor to fragile rebounds and next-open downside slippage in a CNC book.","sortino 3.320 did not improve on prev 3.4038275153908293 | anti-overfit FAILED: sub_period_stationarity(signed min/max Sortino ratio across 2 sub-periods = 0.1931 (need ≥ 0.20); sub-periods = [+4.417, +0.853])"
2026-05-17-4a06d05,2026-05-17T01:56:31,REVERTED,1.9264134769484083,2.341248422598977,242,True,"Adding a no-new-parameter liquidity participation guard should improve validation Sortino by avoiding momentum candidates whose recent advance is not supported by above-normal trading volume, which should reduce fragile entries and next-open slippage risk in the Dhan CNC book.","sortino 1.926 did not improve on prev 3.4038275153908293 | anti-overfit FAILED: bonferroni(p=0.0390 >= alpha/N=0.0333) · sub_period_stationarity(signed min/max Sortino ratio across 2 sub-periods = 0.0391 (need ≥ 0.20); sub-periods = [+2.735, +0.107])"
2026-05-17-09f62a6,2026-05-17T01:58:24,REVERTED,3.291077957571126,6.25792524673147,186,True,"Increasing the fixed risk-slot count from 16 to 18 will improve mean validation Sortino by reducing single-name downside concentration while keeping the same proven PIT-safe momentum-quality ranker, gross exposure, cadence, and sector cap.","sortino 3.291 did not improve on prev 3.4038275153908293 | anti-overfit FAILED: sub_period_stationarity(signed min/max Sortino ratio across 2 sub-periods = 0.1918 (need ≥ 0.20); sub-periods = [+4.380, +0.840])"
2026-05-17-4981859,2026-05-17T02:00:23,REVERTED,3.262973336372913,7.4143582371765655,192,True,"Adding a PIT-safe recent downside-skew preference will improve validation Sortino by favoring momentum leaders whose recent volatility is more upside-driven than downside-driven, reducing fragile long entries without adding a new sizing or cadence parameter.",sortino 3.263 did not improve on prev 3.4038275153908293
2026-05-17-3273648,2026-05-17T02:02:22,REVERTED,2.9785179543241354,6.796625833647988,178,True,"Adding a no-new-parameter weak-market absolute trend guard will improve validation Sortino by avoiding long entries when the current liquid NSE universe median intermediate trend is negative, while preserving the proven stock-level ranker and fixed-slot sizing.",sortino 2.979 did not improve on prev 3.4038275153908293
2026-05-17-edb1f36,2026-05-17T02:06:36,REVERTED,3.4038275153908293,7.3440874574941555,190,True,Adding a PIT-safe same-day adverse news and event overlay will improve mean validation Sortino by avoiding momentum entries exposed to fresh negative company-specific catalysts while leaving the proven price ranker unchanged when no news evidence exists.,sortino 3.404 did not improve on prev 3.4038275153908293
2026-05-17-c39f740,2026-05-17T02:08:38,REVERTED,3.3586248578873974,7.432473429394244,181,True,"Adding a PIT-safe return-correlation diversification pass should improve validation Sortino by reducing clustered long exposure among otherwise high-ranked momentum candidates without changing the underlying price signal, cadence, or fixed-slot sizing.",sortino 3.359 did not improve on prev 3.4038275153908293
2026-05-17-cc7b992,2026-05-17T02:11:08,REVERTED,3.4038275153908293,7.3440874574941555,190,True,"Adding a PIT-safe sector-relative breadth tailwind to the existing ranker will improve validation Sortino by favoring momentum names whose whole sector is leading the current universe, without changing gross exposure, cadence, or fixed-slot sizing.",sortino 3.404 did not improve on prev 3.4038275153908293
2026-05-17-1b85e13,2026-05-17T02:13:08,REVERTED,3.4038275153908293,7.3440874574941555,190,True,"Adding a PIT-safe stale-price continuity filter will improve validation Sortino by excluding momentum candidates whose recent path contains too many zero-return or near-zero-return days, which are often suspended, illiquid, or mechanically stale despite passing the ADV universe screen.",sortino 3.404 did not improve on prev 3.4038275153908293
2026-05-17-960b61f,2026-05-17T02:15:03,REVERTED,3.32756740003344,6.93348717530831,143,True,Reducing the fixed slot count from 16 to 15 should improve validation Sortino by slightly concentrating the already filtered momentum-quality book while still satisfying the catastrophe-control minimum position count and leaving blocked slots as cash.,"sortino 3.328 did not improve on prev 3.4038275153908293 | anti-overfit FAILED: sub_period_stationarity(signed min/max Sortino ratio across 2 sub-periods = 0.1267 (need ≥ 0.20); sub-periods = [+4.550, +0.576])"
2026-05-17-12557e8,2026-05-17T02:27:01,REVERTED,3.149997595876274,6.2939364968450455,193,True,"Adding a PIT-safe post-rank trend-decay veto should improve validation Sortino by avoiding leaders whose 63-day intermediate momentum is positive but materially weaker than their 126-day trend, a common late-cycle fade pattern for biweekly long-only entries.","sortino 3.150 did not improve on prev 3.4038275153908293 | anti-overfit FAILED: sub_period_stationarity(signed min/max Sortino ratio across 2 sub-periods = 0.1547 (need ≥ 0.20); sub-periods = [+4.257, +0.658])"
2026-05-17-60a640b,2026-05-17T02:28:59,REVERTED,3.077605964667462,6.753361497750238,182,True,"Replacing the binary all-or-nothing selection with score-spread gated fixed-slot exposure will improve validation Sortino by keeping weak top-ranked names as cash when the candidate edge is shallow while preserving diversification, PIT universe filtering, and fixed-slot sizing.",sortino 3.078 did not improve on prev 3.4038275153908293
2026-05-17-63b847d,2026-05-17T02:30:56,REVERTED,3.4038275153908293,7.3440874574941555,190,True,"Adding a sector-neutral rank adjustment will improve validation Sortino by preferring momentum leaders that are strong within their own sector rather than only riding crowded sector-wide beta, while preserving the existing 25% sector cap and fixed-slot sizing.",sortino 3.404 did not improve on prev 3.4038275153908293
2026-05-17-18c678e,2026-05-17T02:32:54,REVERTED,3.191569364222781,6.896216688644638,187,True,Adding a PIT-safe portfolio exposure haircut during broad-market stress should improve mean validation Sortino by reducing downside participation in weak NSE regimes while preserving the proven stock ranker and fixed-slot construction.,sortino 3.192 did not improve on prev 3.4038275153908293
2026-05-17-f45e324,2026-05-17T02:37:10,REVERTED,3.333417601728466,7.282774935877682,190,True,Softly rewarding PIT-safe excess 126-day trend versus the current filtered candidate median will improve validation Sortino by preferring idiosyncratic momentum leaders over broad-beta participants without leaving risk slots empty.,sortino 3.333 did not improve on prev 3.4038275153908293
