iteration_id,timestamp,decision,sortino,calmar,trade_count,risk_passed,hypothesis,reason
2026-05-17-ca89660,2026-05-17T04:25:32,REVERTED,3.5551330947298427,7.306364464094143,188,True,"Adding a PIT-safe active-universe relative-momentum confirmation will improve validation Sortino by selecting stocks whose 63-day advance beats the contemporaneous median NSE universe move, separating true leaders from names merely lifted by broad beta.",sortino 3.555 did not improve on prev 3.6277126896862444
2026-05-17-dc0a5c7,2026-05-17T04:27:29,REVERTED,2.9774731584846843,6.1432749112377145,122,True,Adding a PIT-safe turnover hysteresis buffer for currently held names will improve validation Sortino by reducing avoidable Dhan DP-charge churn while only retaining incumbents that still rank near the fixed-slot cutoff.,"sortino 2.977 did not improve on prev 3.6277126896862444 | anti-overfit FAILED: sub_period_stationarity(signed min/max Sortino ratio across 2 sub-periods = 0.1555 (need ≥ 0.20); sub-periods = [+4.023, +0.626])"
2026-05-17-470e15c,2026-05-17T04:29:30,REVERTED,3.280010791992617,7.348448834005286,193,True,"Adding a PIT-safe low-beta defensive participation term will improve validation Sortino by favoring momentum leaders that advance without relying heavily on broad-market up days, reducing drawdown sensitivity while preserving the existing stock-selection edge.",sortino 3.280 did not improve on prev 3.6277126896862444
2026-05-17-60196a4,2026-05-17T04:31:24,REVERTED,3.6049266290537285,7.487771564639833,188,True,Adding a PIT-safe long-horizon trend smoothness veto will improve validation Sortino by avoiding extended winners whose 126-day return is dominated by a small number of jump days rather than persistent accumulation.,sortino 3.605 did not improve on prev 3.6277126896862444
2026-05-17-410e80d,2026-05-17T04:35:04,REVERTED,3.6277126896862444,7.507118314640582,188,True,Replacing greedy sector-cap selection with sector-balanced round-robin selection will improve validation Sortino by reducing hot-sector clustering while preserving the proven stock-level momentum-quality ranking and fixed-slot sizing.,sortino 3.628 did not improve on prev 3.6277126896862444
2026-05-17-e777bfe,2026-05-17T04:37:02,REVERTED,0.9656887845391945,0.7491119115903293,149,True,Adding a PIT-safe downside tail-risk penalty will improve validation Sortino by avoiding momentum names whose recent return distribution contains clustered large negative days that are not fully captured by realized volatility or max drawdown.,"sortino 0.966 did not improve on prev 3.6277126896862444 | anti-overfit FAILED: bonferroni(p=0.0790 >= alpha/N=0.0100) · sub_period_stationarity(signed min/max Sortino ratio across 2 sub-periods = -0.0873 (need ≥ 0.20); sub-periods = [+1.451, -0.127])"
2026-05-17-62ff9dc,2026-05-17T04:39:16,REVERTED,3.5497888018017485,7.501536347631426,192,True,"Adding a PIT-safe 126-day range-location anchor will improve validation Sortino by preferring momentum names trading in the upper part of their full trend window, distinguishing durable breakouts from shorter intermediate rebounds already captured by the 63-day range signal.",sortino 3.550 did not improve on prev 3.6277126896862444
2026-05-17-e580dda,2026-05-17T04:41:17,REVERTED,3.5787061120452504,7.418553112760083,190,True,"Adding a PIT-safe short-term reversal risk check will improve validation Sortino by avoiding momentum candidates that have just printed an unusually large 5-day advance relative to their own recent daily volatility, which current raw fast-return exhaustion does not volatility-normalize.",sortino 3.579 did not improve on prev 3.6277126896862444
2026-05-17-d4598d7,2026-05-17T04:43:14,REVERTED,2.819508799107724,6.311341207842769,194,False,"Adding a PIT-safe overnight gap fragility penalty will improve validation Sortino by avoiding momentum candidates whose trend has been driven by unstable overnight gaps rather than intraday follow-through, which should matter for CNC fills at the next open.","sortino 2.820 did not improve on prev 3.6277126896862444 | aggregate DD regressed: 48.7% > prev 15.1% + 10pp tolerance | catastrophe: gross exposure: max 183.6% > 100% (cash account — leverage error) | anti-overfit FAILED: bonferroni(p=0.0340 >= alpha/N=0.0100) · sub_period_stationarity(signed min/max Sortino ratio across 2 sub-periods = -0.1857 (need ≥ 0.20); sub-periods = [+4.439, -0.824])"
2026-05-17-6894b6d,2026-05-17T04:45:15,REVERTED,3.1592703992044564,6.91112004482518,177,True,"Adding a PIT-safe cross-sectional breadth gate will improve validation Sortino by keeping the book invested only when enough active NSE names have positive intermediate trends, avoiding weak-market momentum traps without relying on coarse macro labels.","sortino 3.159 did not improve on prev 3.6277126896862444 | anti-overfit FAILED: parsimony(baseline params=8, strategy=10; +2 param(s) need Sortino +0.20, has -0.47)"
2026-05-17-b0cdde2,2026-05-17T04:47:15,REVERTED,2.823093148521248,6.26451439302543,193,True,Adding a PIT-safe liquidity participation quality term will improve validation Sortino by preferring momentum candidates whose recent advances are supported by volume expansion rather than low-participation price drift.,"sortino 2.823 did not improve on prev 3.6277126896862444 | anti-overfit FAILED: sub_period_stationarity(signed min/max Sortino ratio across 2 sub-periods = 0.1470 (need ≥ 0.20); sub-periods = [+3.828, +0.563])"
2026-05-17-7989a82,2026-05-17T04:56:53,REVERTED,3.6277126896862444,7.507118314640582,188,True,Adding a PIT-safe adverse-news and event-risk overlay will improve validation Sortino by avoiding momentum candidates whose recent classifier-confirmed negative headlines create idiosyncratic gap risk not captured by price-only volatility and drawdown filters.,sortino 3.628 did not improve on prev 3.6277126896862444
2026-05-17-740e840,2026-05-17T04:58:51,REVERTED,3.4929560237790724,6.410372786880712,184,True,"Increasing fixed risk slots from 16 to 18 will improve validation Sortino by reducing single-name concentration and drawdown drag while preserving the existing proven ranking signal, sector cap, and cash-aware fixed-slot sizing.",sortino 3.493 did not improve on prev 3.6277126896862444
2026-05-17-f8c1bf2,2026-05-17T05:00:42,REVERTED,3.4515527078967096,7.069279102100814,148,True,Reducing fixed risk slots from 16 to 15 will improve validation Sortino by concentrating slightly more capital in the strongest already-filtered momentum-quality names while staying inside the catastrophe and sector-cap constraints.,"sortino 3.452 did not improve on prev 3.6277126896862444 | anti-overfit FAILED: sub_period_stationarity(signed min/max Sortino ratio across 2 sub-periods = 0.1915 (need ≥ 0.20); sub-periods = [+4.595, +0.880])"
2026-05-17-12af9cb,2026-05-17T05:02:53,REVERTED,3.5767343719361246,7.589787539688569,188,True,Raising fixed-slot gross exposure from 0.97 to 0.99 will improve validation Sortino by diluting fixed per-scrip Dhan DP charges while keeping target gross below the 100% catastrophe gate.,sortino 3.577 did not improve on prev 3.6277126896862444
2026-05-17-fc52d3f,2026-05-17T05:04:52,REVERTED,3.6277126896862444,7.507118314640582,188,True,Adding a PIT-safe minimum score margin for selected names will improve validation Sortino by keeping weakly qualified momentum candidates as cash instead of forcing every fixed slot to hold a marginal name.,sortino 3.628 did not improve on prev 3.6277126896862444
2026-05-17-a569e34,2026-05-17T05:07:02,REVERTED,2.957796279672531,6.726494258717063,206,True,"Replacing the primary momentum leg with a one-week-lagged trend score will improve validation Sortino by reducing rank reward for names whose apparent 126-day momentum is mostly a just-printed short-term surge, while preserving the existing fixed-slot construction.","sortino 2.958 did not improve on prev 3.6277126896862444 | anti-overfit FAILED: sub_period_stationarity(signed min/max Sortino ratio across 2 sub-periods = 0.1229 (need ≥ 0.20); sub-periods = [+4.051, +0.498])"
2026-05-17-10a5086,2026-05-17T05:11:07,REVERTED,3.530384116656502,7.289828307411558,188,True,"Adding a no-new-parameter macro stress throttle will improve validation Sortino by cutting gross exposure only when India VIX stress and Nifty 50 trend deterioration coincide, reducing downside folds without changing the proven stock-ranking signal.",sortino 3.530 did not improve on prev 3.6277126896862444
2026-05-17-58f2856,2026-05-17T05:13:07,REVERTED,3.4014946587489425,4.7307838021758295,175,True,Replacing the current absolute 126-day momentum score with a sector-neutral momentum residual will improve validation Sortino by selecting leaders that are strong versus their own industry group rather than simply chasing whichever sector has recently dominated.,"sortino 3.401 did not improve on prev 3.6277126896862444 | anti-overfit FAILED: sub_period_stationarity(signed min/max Sortino ratio across 2 sub-periods = 0.0380 (need ≥ 0.20); sub-periods = [+4.832, +0.183])"
2026-05-17-3f71fee,2026-05-17T05:17:26,REVERTED,3.6277126896862444,7.507118314640582,188,True,Conditioning the existing momentum-quality ranking on active-universe weakness will improve validation Sortino by rotating defensive relative-strength and low-risk names into the fixed slots during broad NSE drawdowns without reducing gross exposure across all regimes.,sortino 3.628 did not improve on prev 3.6277126896862444
2026-05-17-d98449a,2026-05-17T05:19:20,REVERTED,2.2440424353655413,5.3341989922552715,200,True,Switching the biweekly rebalance to the opposite Friday cohort will improve mean validation Sortino by changing execution timing without adding signal parameters or increasing concentration.,"sortino 2.244 did not improve on prev 3.6277126896862444 | anti-overfit FAILED: sub_period_stationarity(signed min/max Sortino ratio across 2 sub-periods = -0.0366 (need ≥ 0.20); sub-periods = [+3.295, -0.120])"
2026-05-17-d13d1c2,2026-05-17T05:21:14,REVERTED,3.471515850089183,6.714571028828539,147,True,Tightening the existing sector cap from 25% to roughly 20% will improve validation Sortino by reducing concentration in hot NSE sector clusters while preserving the proven stock-level momentum-quality ranking and fixed-slot sizing.,sortino 3.472 did not improve on prev 3.6277126896862444
2026-05-17-0d0f5bd,2026-05-17T05:23:12,REVERTED,2.946437103053602,6.147345345000831,118,True,"Adding score-rank retention for current holdings will improve validation Sortino by reducing biweekly churn and Dhan DP-cost drag while keeping the same signal family, fixed-slot sizing, universe gate, and 25% sector cap.","sortino 2.946 did not improve on prev 3.6277126896862444 | anti-overfit FAILED: sub_period_stationarity(signed min/max Sortino ratio across 2 sub-periods = 0.1318 (need ≥ 0.20); sub-periods = [+4.020, +0.530])"
2026-05-17-421ae8b,2026-05-17T05:25:11,REVERTED,3.393162979647798,7.469450891548508,190,True,Adding a PIT-safe downside-asymmetry quality term will improve validation Sortino by preferring momentum names whose recent gains are earned with smaller downside moves rather than merely lower total volatility.,sortino 3.393 did not improve on prev 3.6277126896862444
2026-05-17-ad77252,2026-05-17T05:27:49,REVERTED,2.6140051743309716,5.762429537857258,188,True,"Adding a PIT-safe downside market-beta guard will improve validation Sortino by avoiding momentum names that amplify active-universe down days, reducing downside volatility without changing cadence, gross exposure, fixed-slot sizing, or sector caps.","sortino 2.614 did not improve on prev 3.6277126896862444 | anti-overfit FAILED: sub_period_stationarity(signed min/max Sortino ratio across 2 sub-periods = 0.1035 (need ≥ 0.20); sub-periods = [+3.610, +0.374])"
2026-05-17-2d106b4,2026-05-17T05:29:46,REVERTED,3.3290084093658305,4.9395935876810535,178,True,"Adding a PIT-safe long-horizon trend confirmation veto will improve validation Sortino by avoiding intermediate momentum names whose 126-day trend is positive but still below their slower 252-day trend anchor, reducing weak-cycle false breakouts without changing sizing, cadence, or sector caps.",sortino 3.329 did not improve on prev 3.6277126896862444
2026-05-17-7474ccd,2026-05-17T05:31:43,REVERTED,1.2700836928718184,2.59117464071012,213,True,"Adding a PIT-safe recent close-strength term will improve validation Sortino by preferring momentum candidates that repeatedly finish near the upper part of their daily ranges, capturing persistent demand without adding a new parameter or changing sizing, cadence, gross exposure, or sector caps.","sortino 1.270 did not improve on prev 3.6277126896862444 | anti-overfit FAILED: bonferroni(p=0.0565 >= alpha/N=0.0100) · sub_period_stationarity(signed min/max Sortino ratio across 2 sub-periods = -0.0405 (need ≥ 0.20); sub-periods = [+1.868, -0.076])"
2026-05-17-ff1f4cb,2026-05-17T05:33:45,REVERTED,3.449701795430389,7.393490524324283,189,True,"Adding a PIT-safe liquidity stability guard will improve validation Sortino by avoiding momentum candidates whose recent volume is too erratic or thin relative to their own history, reducing fragile breakouts without changing cadence, slots, gross exposure, or sector caps.",sortino 3.450 did not improve on prev 3.6277126896862444
2026-05-17-6a723a1,2026-05-17T05:35:36,REVERTED,3.17852872274392,6.812767543390047,121,True,"Switching the proven momentum-quality book from biweekly to four-week rebalancing will improve validation Sortino by reducing Dhan DP-cost drag and rank-churn whipsaw while keeping the same PIT universe gate, fixed-slot sizing, sector cap, and stock-selection thesis.","sortino 3.179 did not improve on prev 3.6277126896862444 | anti-overfit FAILED: sub_period_stationarity(signed min/max Sortino ratio across 2 sub-periods = 0.1654 (need ≥ 0.20); sub-periods = [+4.277, +0.708])"
2026-05-17-597c303,2026-05-17T05:37:42,REVERTED,2.988123456834664,6.781890304590799,193,True,Replacing the primary current-to-126-day momentum leg with classic one-month-skipped intermediate momentum will improve validation Sortino by ranking persistent seasoned winners instead of names whose score is dominated by very recent surge/reversal noise.,"sortino 2.988 did not improve on prev 3.6277126896862444 | anti-overfit FAILED: sub_period_stationarity(signed min/max Sortino ratio across 2 sub-periods = 0.0798 (need ≥ 0.20); sub-periods = [+4.168, +0.333])"
2026-05-17-72bfecd,2026-05-17T05:39:39,REVERTED,3.089512926676443,6.392082046767415,169,True,"Adding a PIT-safe breadth participation gate will improve validation Sortino by holding cash on rebalance days when the active universe's own intermediate trend participation is weak, reducing broad-market drawdown exposure without changing the stock-level ranking family.",sortino 3.090 did not improve on prev 3.6277126896862444
2026-05-17-a818f88,2026-05-17T05:41:37,REVERTED,3.6277126896862444,7.507118314640582,188,True,"Adding a PIT-safe intra-book correlation guard will improve validation Sortino by preventing the fixed-slot momentum book from filling multiple slots with near-duplicate price paths, reducing clustered drawdowns while preserving the proven stock-level ranking thesis.",sortino 3.628 did not improve on prev 3.6277126896862444
2026-05-17-7eb1b82,2026-05-17T05:43:37,KEPT,3.645505465789117,7.485932309318195,189,True,Adding a PIT-safe volume-confirmed accumulation term will improve validation Sortino by preferring momentum names whose advance is supported by heavier up-day participation rather than fragile price-only moves.,"sortino 3.646 > prev 3.6277126896862444, agg_dd 15.1%, catastrophe gate clear, anti-overfit gates passed"
2026-05-17-0e272a9,2026-05-17T05:45:46,REVERTED,3.6293118938676137,7.461465399097744,188,True,Adding a PIT-safe volatility compression term will improve validation Sortino by favoring momentum names whose recent advance is becoming less noisy rather than increasingly unstable.,sortino 3.629 did not improve on prev 3.645505465789117
2026-05-17-fc601cc,2026-05-17T05:48:40,REVERTED,3.5977263146635314,7.763336912438318,202,True,"Adding a PIT-safe recent gap-follow-through quality term will improve validation Sortino by avoiding momentum names whose gains are being driven by repeated gap-up opens that fade intraday, which are fragile for next-open CNC fills.",sortino 3.598 did not improve on prev 3.645505465789117
2026-05-17-8db0ff3,2026-05-17T05:54:27,REVERTED,3.645505465789117,7.485932309318195,189,True,Adding a narrow PIT news-risk veto will improve validation Sortino by avoiding otherwise strong momentum names when unusually negative current news and event context raise next-open gap risk.,sortino 3.646 did not improve on prev 3.645505465789117
2026-05-17-b59bf36,2026-05-17T05:56:25,REVERTED,3.114830649430181,6.619744401178514,195,True,Adding a PIT-safe short-term mean-reversion entry term will improve validation Sortino by preferring established intermediate momentum names that are not extended over the last week and are therefore less exposed to next-open reversal.,"sortino 3.115 did not improve on prev 3.645505465789117 | anti-overfit FAILED: sub_period_stationarity(signed min/max Sortino ratio across 2 sub-periods = 0.1892 (need ≥ 0.20); sub-periods = [+4.150, +0.785])"
2026-05-17-9f6bf8d,2026-05-17T05:58:24,REVERTED,3.19412961187123,6.979482917025655,241,True,"Adding a PIT-safe early trend-break veto will improve validation Sortino by exiting otherwise high-ranked momentum names when their short-horizon moving-average structure has already rolled over, reducing left-tail continuation losses without changing cadence, sizing, universe gating, or sector caps",sortino 3.194 did not improve on prev 3.645505465789117
2026-05-17-e613e56,2026-05-17T06:00:41,REVERTED,3.5648330112272104,7.23544879838324,183,True,Adding a PIT-safe broad-market stress overlay will improve validation Sortino by keeping the proven accumulation/momentum stock ranking intact while cutting gross exposure only when continuous India VIX and Nifty trend signals indicate elevated index-level downside risk.,sortino 3.565 did not improve on prev 3.645505465789117
2026-05-17-f823563,2026-05-17T06:02:38,REVERTED,3.3837107403812343,7.366513910897753,197,True,"Adding a PIT-safe volatility-normalized momentum score will improve validation Sortino by ranking persistent winners by return earned per unit of realized risk instead of raw return alone, reducing noisy high-beta momentum exposure without changing universe handling, cadence, sector caps, or fixed-s",sortino 3.384 did not improve on prev 3.645505465789117
2026-05-17-d33108f,2026-05-17T06:05:16,REVERTED,2.9687075896231048,6.140951664526128,221,True,"Increasing fixed risk slots from 16 to 20 will improve mean validation Sortino by reducing single-name concentration and drawdown volatility while preserving the kept accumulation-based ranking, PIT universe gate, biweekly cadence, and 25% sector cap.",sortino 2.969 did not improve on prev 3.645505465789117
2026-05-17-49b7561,2026-05-17T06:07:14,REVERTED,3.516319138080914,6.963803000299243,149,True,Reducing fixed risk slots from 16 to 15 will improve validation Sortino by concentrating the already-kept accumulation/momentum ranking in the strongest names while still satisfying the minimum position-count and sector-cap constraints.,sortino 3.516 did not improve on prev 3.645505465789117
2026-05-17-7e714c5,2026-05-17T06:09:32,REVERTED,3.645505465789117,7.485932309318195,189,True,"Adding a two-pass sector diversification fill will improve validation Sortino by reducing hot-sector cluster risk while preserving the kept stock-level momentum/accumulation ranking, fixed-slot sizing, PIT universe gate, biweekly cadence, and the hard 25% sector cap.",sortino 3.646 did not improve on prev 3.645505465789117
2026-05-17-698f0a2,2026-05-17T06:11:35,REVERTED,2.719723367831772,5.6521416580861885,112,True,Adding a PIT-safe rebalance retention band will improve validation Sortino by reducing cost-heavy churn and short-horizon whipsaw while keeping only currently qualified holdings that remain strong enough under the existing score.,sortino 2.720 did not improve on prev 3.645505465789117
2026-05-17-65d67af,2026-05-17T06:13:40,REVERTED,3.597360077365871,7.549963245443205,197,True,Adding PIT-safe market-adjusted trend strength will improve validation Sortino by preferring momentum names whose 126-day advance exceeds the active universe median rather than simply riding broad market beta.,sortino 3.597 did not improve on prev 3.645505465789117
2026-05-17-4a6bb8a,2026-05-17T06:15:50,REVERTED,3.642301064169784,7.516300780463253,187,True,"Adding a PIT-safe negative overnight gap risk penalty will improve validation Sortino by avoiding momentum names whose recent path includes repeated adverse open gaps, reducing next-open fill risk and downside tails without changing the kept accumulation ranking thesis.",sortino 3.642 did not improve on prev 3.645505465789117
2026-05-17-7424e28,2026-05-17T06:18:47,REVERTED,3.5821307922801133,7.6687161648513715,189,True,"Adding a PIT-safe downside semivolatility asymmetry term will improve validation Sortino by favoring momentum names whose recent volatility is upside-led rather than left-tail dominated, directly targeting downside-risk quality without changing the kept accumulation thesis.",sortino 3.582 did not improve on prev 3.645505465789117
2026-05-17-7d290ea,2026-05-17T06:31:02,KEPT,3.652368255577813,7.517746244523797,189,True,"Adding a PIT-safe close-location accumulation term will improve validation Sortino by preferring momentum names whose recent up-move closes near daily highs on traded value, filtering distribution-style advances without changing the fixed-slot construction.","sortino 3.652 > prev 3.645505465789117, agg_dd 15.1%, catastrophe gate clear, anti-overfit gates passed"
